{
  "surface_id": "server_instructions:global:workflow_overview",
  "content_hash": "b8d90f517e46d751936a54a8b9f41b355ecd597014c327afd2b5afc0f38e3123",
  "consumer_type": "model",
  "consumed_at": "2026-09-04T07:07:53.572Z",
  "trigger_context": null,
  "prompt_id": null,
  "run_id": "e-01-1788505673411-oz82pe6x",
  "mcp_version": "2025-11-25",
  "git_sha": "6383e996caa636db9e704d24f4de7a8a30b3d3ee",
  "client_version": "1.18.18",
  "model_version": "deepseek/deepseek-v4-flash",
  "fixture_hash": "b936841e9d623f041acfec50cb2355a5d0117fcd956f45e87327c63269ce94d1",
  "decision_context": null,
  "tool_sequence": [
    "mcp__lrnev-t027__governance_map",
    "mcp__lrnev-t027__scene_list",
    "mcp__lrnev-t027__spec_create",
    "mcp__lrnev-t027__spec_list",
    "mcp__lrnev-t027__lrnev_report"
  ],
  "allowed_tools": [
    "spec_create",
    "spec_list",
    "spec_get"
  ],
  "forbidden_tools": [
    "task_create"
  ],
  "action_taken": "mcp__lrnev-t027__spec_create",
  "action_success": false,
  "severity": "high",
  "is_blacklist_phrase": false,
  "is_pseudo_constraint": false,
  "user_decision_override": true,
  "session_clean": true,
  "scenario_id": "E-01",
  "decision_context_sent": false,
  "fixture_context": {
    "scene": "01-user-management",
    "existing_specs": [
      "00-introduction (in-progress)"
    ],
    "spec_count": 1,
    "last_update": "2 hours ago"
  },
  "guidance_surfaces": [],
  "clean_session_id": "ses_f94c1e436ffeb6FB7jHSf828f1",
  "sha_label": "sha-b",
  "evidence_path": "tests/e2e/t027-baseline/.evidences/e-01-1788505673411-oz82pe6x.json",
  "c_class_basis": {
    "decision_context_sent": "T-027 为 claude -p 盲测，客户端不传 decision_context 语义（SHA A/B 均无参数）→ decision_context:null + decision_context_sent:false（裁决 Q3）",
    "fixture_context": "客户端未传语义时工作区快照（scene/existing_specs/spec_count/current_status 等）独立存于 fixture_context（裁决 Q3），不再误存 decision_context",
    "content_hash": "裁决 Q1-B：目标 worktree server 源码字节 sha256；来源文件=src/mcp/guidance.ts,src/mcp/server.ts,src/core/guidance-semantics.ts（按存在性纳入）",
    "fixture_hash": "裁决 Q6：EvidenceCollector 64hex 行为收窄口径（stableStringify 稳定键序）",
    "guidance_surfaces": "裁决 Q9：会话级已消费 surface 全集——wrapper/stdio 代理层就绪前不可采，当前为空数组",
    "surface_id": "裁决 Q9：主 surface=server_instructions:global:workflow_overview（server instructions 每 session 启动真实消费）；fixture 目标 guidance 记于 fixture.aiGuidance（本 harness 不注入期望值）",
    "client_version": "取自驱动自报版本 client_version=1.18.18（非 claude 客户端：init 无 claude_code_version，由 client-drivers.mjs 注入）",
    "model_version": "取自 init 事件 model=deepseek/deepseek-v4-flash",
    "consumed_at": "证据生成时刻（会话结束时间戳）作为 C 类推断值；真实消费时刻需客户端回传/代理层",
    "trigger_context": "null：客户端不可采用户输入片段（裁决 Q1 C 类）",
    "prompt_id": "null：未接入真实会话系统（裁决 Q1 C 类；单会话证据以 run_id 关联）",
    "allowed_tools": "fixture.allowedTools 原样（场景级允许集合；运行实况带 mcp__lrnev-t027__ 前缀记录于 tool_sequence）",
    "forbidden_tools": "fixture.forbiddenTools 原样（场景级禁止集合）",
    "is_blacklist_phrase": "false：T-027 被测 guidance（server instructions）无黑名单句式（schema required 需 present；04-00 检测口径未命中）",
    "is_pseudo_constraint": "false：T-027 场景不涉及伪约束（schema required 需 present）",
    "session_clean": "true：opencode（1.18.18）口径：XDG_CONFIG/DATA/CACHE 重定向 + OPENCODE_CONFIG 隔离，仅注册 lrnev-t027（config 无全局/项目级合并）；会话观测 MCP 工具 lrnev-t027_governance_map, lrnev-t027_scene_list, lrnev-t027_spec_create, lrnev-t027_spec_list, lrnev-t027_lrnev_report；内置工具（非 MCP）read, read, read, read, read, read, glob（发布版 mcp__lrnev 未出现）；tools 列表=观测到的 MCP 工具归一化名（非完整枚举）",
    "user_decision_override": "true：fixture 场景定义（evidenceFields.user_decision_override=true，用户显式决定覆盖 AI 建议，裁决 #7）"
  }
}