{
  "surface_id": "server_instructions:global:workflow_overview",
  "content_hash": "5c4dff008ba7c79e9acb6b68bcafd707759f57c8881a1f4d8f982e360c391a83",
  "consumer_type": "model",
  "consumed_at": "2026-09-03T12:11:12.376Z",
  "trigger_context": null,
  "prompt_id": null,
  "run_id": "e-11-1788437472260-b2cwhkw5",
  "mcp_version": "2025-11-25",
  "git_sha": "45a86e15c896c446a41e48324e646d32c27fb76a",
  "client_version": "2.1.228",
  "model_version": "claude-sonnet-5[1m]",
  "fixture_hash": "05dfec6bf84dd9e5bd35ffc5b98f84292dfe85ce495d96bb130801f6c053b93b",
  "decision_context": null,
  "tool_sequence": [
    "Glob",
    "Glob",
    "Read",
    "Bash",
    "Read",
    "Read",
    "Bash",
    "Bash",
    "Bash",
    "Glob",
    "Grep"
  ],
  "allowed_tools": [],
  "forbidden_tools": [
    "spec_create",
    "scene_create"
  ],
  "action_taken": "Glob",
  "action_success": false,
  "severity": "low",
  "is_blacklist_phrase": false,
  "is_pseudo_constraint": false,
  "user_decision_override": false,
  "session_clean": true,
  "scenario_id": "E-11",
  "decision_context_sent": false,
  "fixture_context": {
    "scene": "01-user-management",
    "user_intent": "analysis request, not organizational decision"
  },
  "guidance_surfaces": [],
  "clean_session_id": "b31bf44d-06d7-470f-9cc0-19e79253a82e",
  "sha_label": "sha-a",
  "evidence_path": "tests/e2e/t027-baseline/.evidences/e-11-1788437472260-b2cwhkw5.json",
  "c_class_basis": {
    "decision_context_sent": "T-027 为 claude -p 盲测，客户端不传 decision_context 语义（SHA A/B 均无参数）→ decision_context:null + decision_context_sent:false（裁决 Q3）",
    "fixture_context": "客户端未传语义时工作区快照（scene/existing_specs/spec_count/current_status 等）独立存于 fixture_context（裁决 Q3），不再误存 decision_context",
    "content_hash": "裁决 Q1-B：目标 worktree server 源码字节 sha256；来源文件=src/mcp/guidance.ts,src/mcp/server.ts,src/core/guidance-semantics.ts（按存在性纳入）",
    "fixture_hash": "裁决 Q6：EvidenceCollector 64hex 行为收窄口径（stableStringify 稳定键序）",
    "guidance_surfaces": "裁决 Q9：会话级已消费 surface 全集——wrapper/stdio 代理层就绪前不可采，当前为空数组",
    "surface_id": "裁决 Q9：主 surface=server_instructions:global:workflow_overview（server instructions 每 session 启动真实消费）；fixture 目标 guidance 记于 fixture.aiGuidance（本 harness 不注入期望值）",
    "client_version": "取自 init 事件 claude_code_version=2.1.228（裁决 Q8）",
    "model_version": "取自 init 事件 model=claude-sonnet-5[1m]",
    "consumed_at": "证据生成时刻（会话结束时间戳）作为 C 类推断值；真实消费时刻需客户端回传/代理层",
    "trigger_context": "null：客户端不可采用户输入片段（裁决 Q1 C 类）",
    "prompt_id": "null：未接入真实会话系统（裁决 Q1 C 类；单会话证据以 run_id 关联）",
    "allowed_tools": "fixture.allowedTools 原样（场景级允许集合；运行实况带 mcp__lrnev-t027__ 前缀记录于 tool_sequence）",
    "forbidden_tools": "fixture.forbiddenTools 原样（场景级禁止集合）",
    "is_blacklist_phrase": "false：T-027 被测 guidance（server instructions）无黑名单句式（schema required 需 present；04-00 检测口径未命中）",
    "is_pseudo_constraint": "false：T-027 场景不涉及伪约束（schema required 需 present）",
    "session_clean": "true：init 事件工具纯净（total=73, t027=42, 发布版 mcp__lrnev=0）",
    "user_decision_override": "false：fixture 场景定义或无法判定（evidenceFields.user_decision_override=false，裁决 #7）"
  }
}